<?xml version="1.0" encoding="UTF-8"?>
<!DOCTYPE TestSession SYSTEM "testsession.dtd">
<?xml-stylesheet href="testsession2html_table.xsl" type="text/xsl"?>
<TestSession>

<SessionData>
 <FunName>testme</FunName>
 <Strategy Coverage="all-branches" IterLimit="none" RecurLimit="none" SuffixLengthLimit="none" />
 <When>Mon Nov 20 16:07:18 2023</When>
 <Version>4.0. Build Tue May  9 15:05:46 2023</Version>
 <TestReportFile>testreport.xml</TestReportFile>
 <TestSessionFile>testsession.xml</TestSessionFile>
</SessionData>
<PrefixData TestCaseID="TC_1" PrefixID="P_4">
 <Time>Mon Nov 20 16:07:18 2023</Time>
 <Dur>0</Dur>
 <Prefix>
  <P BlocID="980" SrcFile="/work/pathcrawler/troubleshoot.c">61</P>
  <N BlocID="984">62a</N>
  <P BlocID="987">62b</P>
 </Prefix>
 <Suffix />
 <PrefixStatus Status="covered" />
 <TestCaseFile>TC_1.xml</TestCaseFile>
 <Verdict Type="interrupt">The tested function was interrupted (signal 11 (SIGSEGV - Invalid memory reference)) after executing the positive branch of the 2nd condition at line number 62 of file /work/pathcrawler/troubleshoot.c.
[pc] Please check your test context.
</Verdict>
</PrefixData>
</TestSession>
