<?xml version="1.0" encoding="UTF-8"?>
<!DOCTYPE TestSession SYSTEM "testsession.dtd">
<?xml-stylesheet href="testsession2html_table.xsl" type="text/xsl"?>
<TestSession>

<SessionData>
 <FunName>Tritype</FunName>
 <Strategy Coverage="all-branches" IterLimit="none" RecurLimit="none" SuffixLengthLimit="none" />
 <When>Tue Jun 27 15:07:51 2023</When>
 <Version>4.0. Build Tue May  9 15:05:46 2023</Version>
 <TestReportFile>testreport.xml</TestReportFile>
 <TestSessionFile>testsession.xml</TestSessionFile>
</SessionData>
<PrefixData TestCaseID="TC_1" PrefixID="P_2">
 <Time>Tue Jun 27 15:07:51 2023</Time>
 <Dur>0</Dur>
 <Prefix>
  <P BlocID="243" SrcFile="TriType.c">10a</P>
 </Prefix>
 <Suffix />
 <PrefixStatus Status="covered" />
 <TestCaseFile>TC_1.xml</TestCaseFile>
 <Verdict Type="unknown" />
</PrefixData>
<PrefixData TestCaseID="TC_2" PrefixID="P_3">
 <Time>Tue Jun 27 15:07:52 2023</Time>
 <Dur>1</Dur>
 <Prefix>
  <N BlocID="243" SrcFile="TriType.c">10a</N>
  <P BlocID="248">10b</P>
 </Prefix>
 <Suffix />
 <PrefixStatus Status="covered" />
 <TestCaseFile>TC_2.xml</TestCaseFile>
 <Verdict Type="unknown" />
</PrefixData>
<PrefixData TestCaseID="TC_3" PrefixID="P_4">
 <Time>Tue Jun 27 15:07:52 2023</Time>
 <Dur>1</Dur>
 <Prefix>
  <N BlocID="243" SrcFile="TriType.c">10a</N>
  <N BlocID="248">10b</N>
  <P BlocID="251">10c</P>
 </Prefix>
 <Suffix />
 <PrefixStatus Status="covered" />
 <TestCaseFile>TC_3.xml</TestCaseFile>
 <Verdict Type="unknown" />
</PrefixData>
<PrefixData TestCaseID="TC_4" PrefixID="P_8">
 <Time>Tue Jun 27 15:07:52 2023</Time>
 <Dur>1</Dur>
 <Prefix>
  <N BlocID="243" SrcFile="TriType.c">10a</N>
  <N BlocID="248">10b</N>
  <N BlocID="251">10c</N>
  <N BlocID="257">12a</N>
  <N BlocID="262">12b</N>
  <N BlocID="265">12c</N>
  <N BlocID="271">14</N>
 </Prefix>
 <Suffix>
  <P BlocID="276" SrcFile="TriType.c">15</P>
  <N BlocID="281">16</N>
  <N BlocID="286">17</N>
 </Suffix>
 <PrefixStatus Status="covered" />
 <TestCaseFile>TC_4.xml</TestCaseFile>
 <Verdict Type="unknown" />
</PrefixData>
<PrefixData TestCaseID="TC_5" PrefixID="P_12">
 <Time>Tue Jun 27 15:07:52 2023</Time>
 <Dur>1</Dur>
 <Prefix>
  <N BlocID="243" SrcFile="TriType.c">10a</N>
  <N BlocID="248">10b</N>
  <N BlocID="251">10c</N>
  <N BlocID="257">12a</N>
  <N BlocID="262">12b</N>
  <N BlocID="265">12c</N>
  <N BlocID="271">14</N>
  <N BlocID="276">15</N>
  <P BlocID="281">16</P>
 </Prefix>
 <Suffix>
  <N BlocID="286" SrcFile="TriType.c">17</N>
 </Suffix>
 <PrefixStatus Status="covered" />
 <TestCaseFile>TC_5.xml</TestCaseFile>
 <Verdict Type="unknown" />
</PrefixData>
<PrefixData TestCaseID="TC_6" PrefixID="P_7">
 <Time>Tue Jun 27 15:07:52 2023</Time>
 <Dur>1</Dur>
 <Prefix>
  <N BlocID="243" SrcFile="TriType.c">10a</N>
  <N BlocID="248">10b</N>
  <N BlocID="251">10c</N>
  <N BlocID="257">12a</N>
  <N BlocID="262">12b</N>
  <N BlocID="265">12c</N>
 </Prefix>
 <Suffix>
  <P BlocID="271" SrcFile="TriType.c">14</P>
  <N BlocID="276">15</N>
  <N BlocID="281">16</N>
  <N BlocID="286">17</N>
 </Suffix>
 <PrefixStatus Status="covered" />
 <TestCaseFile>TC_6.xml</TestCaseFile>
 <Verdict Type="unknown" />
</PrefixData>
<PrefixData TestCaseID="TC_7" PrefixID="P_6">
 <Time>Tue Jun 27 15:07:52 2023</Time>
 <Dur>1</Dur>
 <Prefix>
  <N BlocID="243" SrcFile="TriType.c">10a</N>
  <N BlocID="248">10b</N>
  <N BlocID="251">10c</N>
  <N BlocID="257">12a</N>
  <N BlocID="262">12b</N>
 </Prefix>
 <Suffix>
  <P BlocID="265" SrcFile="TriType.c">12c</P>
 </Suffix>
 <PrefixStatus Status="covered" />
 <TestCaseFile>TC_7.xml</TestCaseFile>
 <Verdict Type="unknown" />
</PrefixData>
<PrefixData TestCaseID="TC_8" PrefixID="P_5">
 <Time>Tue Jun 27 15:07:52 2023</Time>
 <Dur>1</Dur>
 <Prefix>
  <N BlocID="243" SrcFile="TriType.c">10a</N>
  <N BlocID="248">10b</N>
  <N BlocID="251">10c</N>
  <N BlocID="257">12a</N>
 </Prefix>
 <Suffix>
  <P BlocID="262" SrcFile="TriType.c">12b</P>
 </Suffix>
 <PrefixStatus Status="covered" />
 <TestCaseFile>TC_8.xml</TestCaseFile>
 <Verdict Type="unknown" />
</PrefixData>
<PrefixData TestCaseID="TC_9" PrefixID="P_1">
 <Time>Tue Jun 27 15:07:52 2023</Time>
 <Dur>1</Dur>
 <Prefix />
 <Suffix>
  <N BlocID="243" SrcFile="TriType.c">10a</N>
  <N BlocID="248">10b</N>
  <N BlocID="251">10c</N>
  <P BlocID="257">12a</P>
 </Suffix>
 <PrefixStatus Status="covered" />
 <TestCaseFile>TC_9.xml</TestCaseFile>
 <Verdict Type="unknown" />
</PrefixData>
</TestSession>